{
  "$schema": "../../schemas/ptywright-agent.schema.json",
  "name": "claude_browser_smoke",
  "artifactsDir": ".tmp/agent/claude_browser_smoke",
  "snapshotDir": "tests/agent-snapshots/claude_browser_smoke",
  "launch": {
    "mode": "command",
    "agentFlavor": "claude",
    "command": "your-browser-terminal-launcher",
    "args": ["--agent", "claude", "--print-url"],
    "waitForUrlMs": 15000
  },
  "viewports": [
    { "name": "desktop", "width": 1280, "height": 820 },
    { "name": "mobile", "width": 390, "height": 844, "isMobile": true, "hasTouch": true }
  ],
  "defaults": {
    "timeoutMs": 45000,
    "screenshot": true
  },
  "steps": [
    { "type": "waitForStableDom", "timeoutMs": 45000, "quietMs": 600, "intervalMs": 150 },
    { "type": "snapshot", "name": "launch", "targets": ["terminal", "dom", "screenshot"] }
  ]
}
